{
  "schema_version": 1,
  "change_id": "120-l8-assessment-quality-r1",
  "lineage_id": "l8-assessment-quality",
  "revision": 1,
  "supersedes": null,
  "previous_status": null,
  "governance_record_risk": "R3",
  "title": "E4 mekanizması: MCQ kalite sinyalleri ve rubrik ikinci doğrulayıcı",
  "summary": "Kuyruktaki E4 işi hiçbir şeride atanmamıştı. İki saf modül eklendi: quality.py sekiz ölçülebilir MCQ kusur sinyali üretir (yakın-tekrar, aynıya normalleşen şık, kapsayıcı şık, uzunluk aykırılığı, paralellik kırılması, etiketsiz çeldirici, test edilmemiş/aşırı kullanılmış yanılgı); second_pass.py iki bağımsız rubrik değerlendirmesini kalem kalem uzlaştırır ve ikinci koşu yoksa fail-closed inconclusive verir. İkisi de veritabanı, ağ ve LLM'e dokunmaz; hiçbir üretim yolundan çağrılmıyor, dolayısıyla öğrenciye giden puan değişmedi.",
  "owner": "Muratcan Ateş",
  "created_at": "2026-09-14T08:30:00+00:00",
  "review_by": "2026-10-14T08:30:00+00:00",
  "base_sha": "7a171e57d6800b03c8010e690e4a2d1b0f0bf997",
  "candidate_sha": "SELF",
  "risk_tier": "R3",
  "status": "evidence-ready",
  "behavior": {
    "provider_revision": "Unchanged from 7a171e5; new offline mechanism only, no provider/model/prompt path touched.",
    "model_revision": "Unchanged from 7a171e5; new offline mechanism only, no provider/model/prompt path touched.",
    "prompt_revision": "Unchanged from 7a171e5; new offline mechanism only, no provider/model/prompt path touched.",
    "tool_schema_revision": "Unchanged from 7a171e5; new offline mechanism only, no provider/model/prompt path touched.",
    "guardrail_revision": "Unchanged from 7a171e5; new offline mechanism only, no provider/model/prompt path touched.",
    "retrieval_revision": "Unchanged from 7a171e5; new offline mechanism only, no provider/model/prompt path touched.",
    "embedding_revision": "Unchanged from 7a171e5; new offline mechanism only, no provider/model/prompt path touched.",
    "evaluator_revision": "Unchanged from 7a171e5; new offline mechanism only, no provider/model/prompt path touched."
  },
  "data": {
    "corpus_digest": "8739c119e1a49614d11799e23a5c96362cc0cb57c225a83de932c479ed689305",
    "eval_set_digest": "8739c119e1a49614d11799e23a5c96362cc0cb57c225a83de932c479ed689305",
    "privacy_classification": "synthetic-non-personal"
  },
  "artifacts": [
    {
      "path": "apps/api/app/modules/assessment/quality.py",
      "state": "present",
      "sha256": "8739c119e1a49614d11799e23a5c96362cc0cb57c225a83de932c479ed689305"
    },
    {
      "path": "apps/api/app/modules/assessment/second_pass.py",
      "state": "present",
      "sha256": "a63b4b6462903e838837e0ee1ba341f68f7b4f40e3a53b375a026060154be8ad"
    },
    {
      "path": "apps/api/tests/test_assessment_quality.py",
      "state": "present",
      "sha256": "501289cf5ea6ef77e515a08c6945c16f2422507130dc5fb01f554c7b1994f947"
    },
    {
      "path": "apps/api/tests/test_grading_second_pass.py",
      "state": "present",
      "sha256": "ecb97560ef41179174230c7abb530e52a74b31b6952e5fd8e8b112efdf31368f"
    }
  ],
  "evidence": [
    {
      "label": "offline-replay",
      "result": "pass",
      "report_path": ".ai/evidence/120-l8-assessment-quality-r1.json",
      "report_sha256": "3aabdb941657ac6d6597ef3def0735149c7df277ad403adc308b1cd2e309c8ac",
      "candidate_sha": "SELF"
    }
  ],
  "evaluation": {
    "calibration_ref": "apps/api/tests/test_assessment_quality.py",
    "holdout_ref": "apps/api/tests/test_grading_second_pass.py",
    "thresholds_declared_before_scoring": true,
    "human_anchor_ref": "evaluation/acceptance/assessment_cases.json",
    "metrics": [
      {
        "name": "assessment_quality_tests_passed",
        "baseline": 0,
        "candidate": 58,
        "operator": ">=",
        "threshold": 58,
        "sample_size": 58
      },
      {
        "name": "second_pass_tests_passed",
        "baseline": 0,
        "candidate": 59,
        "operator": ">=",
        "threshold": 59,
        "sample_size": 59
      },
      {
        "name": "mypy_source_files_clean",
        "baseline": 121,
        "candidate": 123,
        "operator": ">=",
        "threshold": 123,
        "sample_size": 123
      }
    ],
    "exact_command": "cd apps/api && TEST_DB_NAME=dou_l8_reb .venv/bin/python -m pytest -q tests/test_assessment_quality.py tests/test_grading_second_pass.py && .venv/bin/mypy app"
  },
  "approval_requirements": [
    {
      "role": "engineering",
      "actor": "Pending engineering reviewer",
      "decision": "pending",
      "approval_ref": null,
      "approved_at": null,
      "candidate_sha": "SELF",
      "independent_of_author": true
    },
    {
      "role": "domain",
      "actor": "Pending domain reviewer",
      "decision": "pending",
      "approval_ref": null,
      "approved_at": null,
      "candidate_sha": "SELF",
      "independent_of_author": true
    },
    {
      "role": "security_or_privacy",
      "actor": "Pending security or privacy reviewer",
      "decision": "pending",
      "approval_ref": null,
      "approved_at": null,
      "candidate_sha": "SELF",
      "independent_of_author": true
    }
  ],
  "deployment": {
    "feature_flag": "not-applicable: çevrimdışı mekanizma, hiçbir üretim yolundan çağrılmıyor",
    "flag_state": "disabled",
    "candidate_sha": "SELF",
    "deployment_id": "not-deployed:018-l8-unassigned",
    "environment": "not-deployed"
  },
  "rollout": {
    "feature_flag": "not-applicable: çevrimdışı mekanizma, hiçbir üretim yolundan çağrılmıyor",
    "kill_switch": "Mekanizma bir ürün yoluna bağlanırsa ve ikinci koşu yokluğunda agreed dönerse bağlantı geri alınır. Kalibre edilmemiş eşik 'doğrulanmış eşik' diye anılırsa kayıt geri çekilir.",
    "assignment": "Sticky to the exact reviewed candidate SHA; no real-user exposure.",
    "initial_exposure": "None; yalnız yerel çevrimdışı koşu. Öğrenciye giden hiçbir yol değişmedi.",
    "stop_conditions": [
      "İkinci koşu yokken puan gösterilebilir sayılır.",
      "Kalibre edilmemiş eşik ölçülmüş gibi raporlanır.",
      "Kalite sinyali eğitmen incelemesi yerine otomatik red kararına dönüştürülür."
    ],
    "expand_conditions": [
      "Adlandırılmış engineering/domain/privacy sahipleri ayrı ayrı onaylar.",
      "Mekanizma bir ürün yoluna bağlanmadan önce o bağlantı ayrıca incelenir."
    ],
    "active_exam_policy": "No academic record, active-exam lock, help scope or role change."
  },
  "rollback": {
    "previous_compatible_artifact": "base:7a171e57d6800b03c8010e690e4a2d1b0f0bf997",
    "procedure": "Bu commit geri alınır; yeni dosyalar silinir. Çağıranı olmadığı için davranış değişimi yoktur, veri göçü yoktur.",
    "max_minutes": 30,
    "verification": "Planned operator response, not measured production SLA.",
    "state": "planned",
    "evidence_report_path": null,
    "evidence_report_sha256": null,
    "evidence_candidate_sha": null,
    "evidence_deployment_id": null
  },
  "privacy": {
    "contains_identifiable_student_content": false,
    "handling": "Yalnız sentetik fixture ve yerel çevrimdışı koşu. Gerçek öğrenci içeriği, sağlayıcı anahtarı veya kişisel veri yok.",
    "retention": "Kurumsal saklama ve gerçek sağlayıcı yaşam döngüsü açık; üretime terfi yok."
  },
  "promotion": {
    "claim": "none",
    "target": "none",
    "human_approval_refs": []
  }
}
